[
  {
    "id": "13131313-1313-4131-8131-131313131313",
    "siteId": "11111111-1111-4111-8111-111111111111",
    "sensorId": "temp-c01",
    "tankId": "33333333-3333-4333-8333-333333333333",
    "measuredAt": "2026-05-18T09:00:00.000Z",
    "metrics": { "temperatureC": 13.4, "ph": 3.55, "volumeLiters": 7200 },
    "rawPayload": { "source": "fixture" },
    "createdAt": "2026-05-18T09:00:00.000Z",
    "updatedAt": "2026-05-18T09:00:00.000Z"
  }
]
