[
  {
    "id": "80000001-0000-4000-8000-000000000001",
    "siteId": "11111111-1111-4111-8111-111111111111",
    "sensorId": "temp-c1",
    "tankId": "30000001-0000-4000-8000-000000000001",
    "measuredAt": "2026-05-18T09:00:00.000Z",
    "metrics": {
      "temperatureC": 11,
      "density": 1.015,
      "co2Gpl": 1
    },
    "rawPayload": {
      "demo": true
    },
    "createdAt": "2026-05-18T09:00:00.000Z",
    "updatedAt": "2026-05-18T09:00:00.000Z"
  },
  {
    "id": "80000002-0000-4000-8000-000000000002",
    "siteId": "11111111-1111-4111-8111-111111111111",
    "sensorId": "temp-c2",
    "tankId": "30000002-0000-4000-8000-000000000002",
    "measuredAt": "2026-05-18T09:00:00.000Z",
    "metrics": {
      "temperatureC": 12,
      "density": 1.0159999999999998,
      "co2Gpl": 1.1
    },
    "rawPayload": {
      "demo": true
    },
    "createdAt": "2026-05-18T09:00:00.000Z",
    "updatedAt": "2026-05-18T09:00:00.000Z"
  },
  {
    "id": "80000003-0000-4000-8000-000000000003",
    "siteId": "11111111-1111-4111-8111-111111111111",
    "sensorId": "temp-c3",
    "tankId": "30000003-0000-4000-8000-000000000003",
    "measuredAt": "2026-05-18T09:00:00.000Z",
    "metrics": {
      "temperatureC": 13,
      "density": 1.017,
      "co2Gpl": 1.2
    },
    "rawPayload": {
      "demo": true
    },
    "createdAt": "2026-05-18T09:00:00.000Z",
    "updatedAt": "2026-05-18T09:00:00.000Z"
  },
  {
    "id": "80000004-0000-4000-8000-000000000004",
    "siteId": "11111111-1111-4111-8111-111111111111",
    "sensorId": "temp-c4",
    "tankId": "30000004-0000-4000-8000-000000000004",
    "measuredAt": "2026-05-18T09:00:00.000Z",
    "metrics": {
      "temperatureC": 14,
      "density": 1.0179999999999998,
      "co2Gpl": 1.3
    },
    "rawPayload": {
      "demo": true
    },
    "createdAt": "2026-05-18T09:00:00.000Z",
    "updatedAt": "2026-05-18T09:00:00.000Z"
  },
  {
    "id": "80000005-0000-4000-8000-000000000005",
    "siteId": "11111111-1111-4111-8111-111111111111",
    "sensorId": "temp-c5",
    "tankId": "30000005-0000-4000-8000-000000000005",
    "measuredAt": "2026-05-18T09:00:00.000Z",
    "metrics": {
      "temperatureC": 15,
      "density": 1.019,
      "co2Gpl": 1.4
    },
    "rawPayload": {
      "demo": true
    },
    "createdAt": "2026-05-18T09:00:00.000Z",
    "updatedAt": "2026-05-18T09:00:00.000Z"
  },
  {
    "id": "80000006-0000-4000-8000-000000000006",
    "siteId": "11111111-1111-4111-8111-111111111111",
    "sensorId": "temp-c6",
    "tankId": "30000006-0000-4000-8000-000000000006",
    "measuredAt": "2026-05-18T09:00:00.000Z",
    "metrics": {
      "temperatureC": 16,
      "density": 1.0199999999999998,
      "co2Gpl": 1.5
    },
    "rawPayload": {
      "demo": true
    },
    "createdAt": "2026-05-18T09:00:00.000Z",
    "updatedAt": "2026-05-18T09:00:00.000Z"
  },
  {
    "id": "80000007-0000-4000-8000-000000000007",
    "siteId": "11111111-1111-4111-8111-111111111111",
    "sensorId": "temp-c7",
    "tankId": "30000007-0000-4000-8000-000000000007",
    "measuredAt": "2026-05-18T09:00:00.000Z",
    "metrics": {
      "temperatureC": 17,
      "density": 1.021,
      "co2Gpl": 1.6
    },
    "rawPayload": {
      "demo": true
    },
    "createdAt": "2026-05-18T09:00:00.000Z",
    "updatedAt": "2026-05-18T09:00:00.000Z"
  },
  {
    "id": "80000008-0000-4000-8000-000000000008",
    "siteId": "11111111-1111-4111-8111-111111111111",
    "sensorId": "temp-c8",
    "tankId": "30000008-0000-4000-8000-000000000008",
    "measuredAt": "2026-05-18T09:00:00.000Z",
    "metrics": {
      "temperatureC": 18,
      "density": 1.0219999999999998,
      "co2Gpl": 1.7
    },
    "rawPayload": {
      "demo": true
    },
    "createdAt": "2026-05-18T09:00:00.000Z",
    "updatedAt": "2026-05-18T09:00:00.000Z"
  },
  {
    "id": "80000009-0000-4000-8000-000000000009",
    "siteId": "11111111-1111-4111-8111-111111111111",
    "sensorId": "temp-c9",
    "tankId": "30000009-0000-4000-8000-000000000009",
    "measuredAt": "2026-05-18T09:00:00.000Z",
    "metrics": {
      "temperatureC": 10,
      "density": 1.023,
      "co2Gpl": 1.8
    },
    "rawPayload": {
      "demo": true
    },
    "createdAt": "2026-05-18T09:00:00.000Z",
    "updatedAt": "2026-05-18T09:00:00.000Z"
  },
  {
    "id": "80000010-0000-4000-8000-000000000010",
    "siteId": "11111111-1111-4111-8111-111111111111",
    "sensorId": "temp-c10",
    "tankId": "30000010-0000-4000-8000-000000000010",
    "measuredAt": "2026-05-18T09:00:00.000Z",
    "metrics": {
      "temperatureC": 11,
      "density": 1.0239999999999998,
      "co2Gpl": 1.9
    },
    "rawPayload": {
      "demo": true
    },
    "createdAt": "2026-05-18T09:00:00.000Z",
    "updatedAt": "2026-05-18T09:00:00.000Z"
  },
  {
    "id": "80000011-0000-4000-8000-000000000011",
    "siteId": "11111111-1111-4111-8111-111111111111",
    "sensorId": "temp-c11",
    "tankId": "30000011-0000-4000-8000-000000000011",
    "measuredAt": "2026-05-18T09:00:00.000Z",
    "metrics": {
      "temperatureC": 12,
      "density": 1.025,
      "co2Gpl": 2
    },
    "rawPayload": {
      "demo": true
    },
    "createdAt": "2026-05-18T09:00:00.000Z",
    "updatedAt": "2026-05-18T09:00:00.000Z"
  },
  {
    "id": "80000012-0000-4000-8000-000000000012",
    "siteId": "11111111-1111-4111-8111-111111111111",
    "sensorId": "temp-c12",
    "tankId": "30000012-0000-4000-8000-000000000012",
    "measuredAt": "2026-05-18T09:00:00.000Z",
    "metrics": {
      "temperatureC": 13,
      "density": 1.0259999999999998,
      "co2Gpl": 2.1
    },
    "rawPayload": {
      "demo": true
    },
    "createdAt": "2026-05-18T09:00:00.000Z",
    "updatedAt": "2026-05-18T09:00:00.000Z"
  },
  {
    "id": "80000013-0000-4000-8000-000000000013",
    "siteId": "11111111-1111-4111-8111-111111111111",
    "sensorId": "temp-c13",
    "tankId": "30000013-0000-4000-8000-000000000013",
    "measuredAt": "2026-05-18T09:00:00.000Z",
    "metrics": {
      "temperatureC": 14,
      "density": 1.027,
      "co2Gpl": 2.2
    },
    "rawPayload": {
      "demo": true
    },
    "createdAt": "2026-05-18T09:00:00.000Z",
    "updatedAt": "2026-05-18T09:00:00.000Z"
  },
  {
    "id": "80000014-0000-4000-8000-000000000014",
    "siteId": "11111111-1111-4111-8111-111111111111",
    "sensorId": "temp-c14",
    "tankId": "30000014-0000-4000-8000-000000000014",
    "measuredAt": "2026-05-18T09:00:00.000Z",
    "metrics": {
      "temperatureC": 15,
      "density": 1.0279999999999998,
      "co2Gpl": 2.3
    },
    "rawPayload": {
      "demo": true
    },
    "createdAt": "2026-05-18T09:00:00.000Z",
    "updatedAt": "2026-05-18T09:00:00.000Z"
  },
  {
    "id": "80000015-0000-4000-8000-000000000015",
    "siteId": "11111111-1111-4111-8111-111111111111",
    "sensorId": "temp-c15",
    "tankId": "30000015-0000-4000-8000-000000000015",
    "measuredAt": "2026-05-18T09:00:00.000Z",
    "metrics": {
      "temperatureC": 16,
      "density": 1.029,
      "co2Gpl": 2.4
    },
    "rawPayload": {
      "demo": true
    },
    "createdAt": "2026-05-18T09:00:00.000Z",
    "updatedAt": "2026-05-18T09:00:00.000Z"
  },
  {
    "id": "80000016-0000-4000-8000-000000000016",
    "siteId": "11111111-1111-4111-8111-111111111111",
    "sensorId": "temp-c16",
    "tankId": "30000016-0000-4000-8000-000000000016",
    "measuredAt": "2026-05-18T09:00:00.000Z",
    "metrics": {
      "temperatureC": 17,
      "density": 1.0299999999999998,
      "co2Gpl": 2.5
    },
    "rawPayload": {
      "demo": true
    },
    "createdAt": "2026-05-18T09:00:00.000Z",
    "updatedAt": "2026-05-18T09:00:00.000Z"
  },
  {
    "id": "80000017-0000-4000-8000-000000000017",
    "siteId": "11111111-1111-4111-8111-111111111111",
    "sensorId": "temp-c17",
    "tankId": "30000017-0000-4000-8000-000000000017",
    "measuredAt": "2026-05-18T09:00:00.000Z",
    "metrics": {
      "temperatureC": 18,
      "density": 1.031,
      "co2Gpl": 2.6
    },
    "rawPayload": {
      "demo": true
    },
    "createdAt": "2026-05-18T09:00:00.000Z",
    "updatedAt": "2026-05-18T09:00:00.000Z"
  },
  {
    "id": "80000018-0000-4000-8000-000000000018",
    "siteId": "11111111-1111-4111-8111-111111111111",
    "sensorId": "temp-c18",
    "tankId": "30000018-0000-4000-8000-000000000018",
    "measuredAt": "2026-05-18T09:00:00.000Z",
    "metrics": {
      "temperatureC": 10,
      "density": 1.0319999999999998,
      "co2Gpl": 2.7
    },
    "rawPayload": {
      "demo": true
    },
    "createdAt": "2026-05-18T09:00:00.000Z",
    "updatedAt": "2026-05-18T09:00:00.000Z"
  },
  {
    "id": "80000019-0000-4000-8000-000000000019",
    "siteId": "11111111-1111-4111-8111-111111111111",
    "sensorId": "temp-c19",
    "tankId": "30000019-0000-4000-8000-000000000019",
    "measuredAt": "2026-05-18T09:00:00.000Z",
    "metrics": {
      "temperatureC": 11,
      "density": 1.033,
      "co2Gpl": 2.8
    },
    "rawPayload": {
      "demo": true
    },
    "createdAt": "2026-05-18T09:00:00.000Z",
    "updatedAt": "2026-05-18T09:00:00.000Z"
  },
  {
    "id": "80000020-0000-4000-8000-000000000020",
    "siteId": "11111111-1111-4111-8111-111111111111",
    "sensorId": "temp-c20",
    "tankId": "30000020-0000-4000-8000-000000000020",
    "measuredAt": "2026-05-18T09:00:00.000Z",
    "metrics": {
      "temperatureC": 12,
      "density": 1.0339999999999998,
      "co2Gpl": 2.9
    },
    "rawPayload": {
      "demo": true
    },
    "createdAt": "2026-05-18T09:00:00.000Z",
    "updatedAt": "2026-05-18T09:00:00.000Z"
  }
]
